Title,Date,Images,Paragraphs
Twitter 2.0 at the Back of an Envelope,1 DEC 2022,"[https://lh5.googleusercontent.com/tzT11M255XZIfmBFlCD6MYAvVO_LUfSPDziYGfohgJjdc9b-7cJqBf5-BfJ6HEs65cMGZ19gnvNyaji4ACYAwwZbdTCzO2mBjF3j3mprki-lKc9JMDHhLmjzq-2Y9ykV_Ywo8WUF_5iKB99UeQ70wlg], [https://lh4.googleusercontent.com/gghmuGcZ9eNzuEQdzHQWAFF_f1j7X4qRlziwQzWY-b0LQ10W_1Rt2IKsl3QigucBC9xMpEOm6z-kt1q2Zyaodg-8iRq4rvUQZ05wqMsDqtCUbJaCrdy9_o8FIZsrdcIYAEtyViG_ChIt0VRegFdozsw], [https://lh5.googleusercontent.com/4TwKFlR5a_arH134L3bYRx62icXnzdRlA4pzH5TDGW8PgVcyBeYoog5WVp_YcY7XH3GfDyB8P2EgjKyFdCQCW4BztM3Kvl6niI8VfIWUZdXQq66F8D2uPb3ujgzM2t0tiVN_Iw4rkv5u_JR2k8RaPjs], [https://lh6.googleusercontent.com/KRezvoZEyRtN4aVXlMI7CMcRDlmx4WOqCygzXRC6a1FSepj3kYUqxqJ_8Ai4XpiI73E4QIMy78QhOjW9dw7Y9vbUzntM0rH8AmdhyvQAYrZQ9hY4zv1Z8wd1AZm-R__Qptv2ZON41w7Ga2HijOTXBZ4], [https://lh6.googleusercontent.com/fT4AHZhRLBCvY2zQi6ZOKR35wFLAyUuE1WgxTViP3lvdd2WTIEH7yIGEzjgya613NWVQphWjMfdssb0f7zZOP3WgpgZz0hqZDviR_WxirRMakiuHr8uTpbU1_vD4sZvdJkMxZdSkYeLJNa5OTyM6soE], ","[Let's understand how we can do back of the envelope calculations, and view the Twitter's engineering challenges from the eyes of its decision makers.], [Read more posts by this author.], [A Back of the envelope calculation is a simple arithmetic operation frequently carried out on a little piece of paper, like an envelope. Back of the envelope analysis quickly generates a ballpark figure using approximated or rounded figures. An estimate is more accurate than a wild guess but less exact than a formal calculation using precise numbers in a spreadsheet or other program. These computations are typical for folks who have a sudden inspiration for an idea or wish to estimate a quantity quickly.], [In honor of physicist Enrico Fermi, back of the envelope computations are often referred to as Fermi issues. Fermi was renowned for his ability to approximate issues accurately even with very little data.], [In this article, we will talk about this methodology's history, applications, and best practices. Furthermore, I will provide a storage cost analysis of Twitter 2.0 and a cheat sheet at the end so that you can conduct your estimations. Just a disclaimer - the calculations that are about to be added, are made with heavy assumptions - looking at Twitter 2.0 as a new service that we’ll be building & basic components required for the same. The calculations don’t involve considerations of economies of scale, redundancy, replication and most estimations that involve scaling. We are just understanding a basic implementation of storage for the app, for the scale it is it
], [Twitter 2.0’s System Design diagram shared by Elon Musk in November 2022 - Source
], [The calculation generally informs us if the design can satisfy the functional requirements, such as the number of supported users, response latency, and resource needs. For instance, when deciding between different architectural designs, the simplest question to ask is whether one server is enough. To get a ballpark figure, we can quickly calculate how many servers we would require, if not one.
], [Some of the use cases where back of the envelope calculation has been used:], [We've looked at some of the important historical applications of the back of the envelope, now we'll examine the arithmetic process to see how we can utilise it to solve our own issues. This will help you retain this knowledge as well as expand your understanding of how these calculations work.], [Whenever we try to learn something new, we have to be well-versed with the most basic & frequently used tools. Similarly, when beginning system design estimations, we have to know certain common numbers that help us consolidate our understanding. A subset of these numbers, used for estimating the speed of a system, are known as “Latency Numbers.” Latency, as a term, helps measure the time it will take for data to pass from one point in a network to another. It is measured in milliseconds for most systems. For example, the latency of the best video chat applications, such as Google Meet is 100 milliseconds or less. This means it takes 100 milliseconds or less for data to be exchanged between the video chat participants’ computers.], [Before approximating the real utilization, we must acknowledge that our system has limited resources. For instance, we want to know if we can handle all user requests on a single server despite our servers only being equipped with 2GHz CPUs.], [How can we guess the real usage?], [The utilization must be divided into its component parts before being roughly estimated (and, if necessary, further divided) and combined.], [For instance, we might anticipate 1K active users, each of whom submits 15 requests daily.], [15K requests per day, or 15K/86400 requests per second, are involved.], [An effective method for assembling the components is to round tightly. Nobody likes to multiply by 86400. To give 0.2 seconds to serve a single request, let's round to 20K/100K. We need to set up at least 4 computers if we know that it takes 0.7 seconds to serve one request. Of course, you don't want to live on the edge, so let's increase the number of machines by a buffer and make it ten.], [If someone asked you to calculate: 2456000 x 4598; that would slow things down, wouldn’t it?
], [The simpler way to calculate quickly would be instead of spelling down a whole number, use small numbers paired with an abbreviation for magnitude (or, if necessary, exponents). 1K as opposed to 1000.], [When given a huge, excessively exact number, such as 7432, immediately translate it to 7K. Anyhow, you are estimating.], [This format for numbers makes multiplication and division quick.], [KK is M. [K is Kilo; M is Mega]], [G/M is K. [G is Giga]], [4K7M = 28G.], [Round both of them towards a small multiple of a power of 2 or 10 to work with larger numbers.], [List the common use-cases of the system and decide which critical resources they require. You'll need a lot of storage for a document repository. Estimating document counts and sizes is a good place to start, but further usage will determine specifics. How frequently do new papers get added? The papers - can you search them? Are any indices required? Is the app more read-heavy or write-heavy?], [Varied use cases will probably require significantly different resource shapes. For instance, serving documents might require a lot of RAM but not CPU, whereas preprocessing new documents would require CPU but not RAM. Since you need to purchase machines that are maxed out on both dimensions, hosting all those services on homogeneous machines would waste CPU and RAM.], [Such differences indicate those features should be split to different services, hosted on independent sets of machines.], [Source
], [Please note the following numbers are for this exercise only as they are not real numbers from Twitter.], [Assumptions:], [Estimations:], [Query per second (QPS) estimate:], [There are 2 important queries that need to be addressed for any system:], [Let’s start with “requests per second” & what inputs are required to estimate its number], [Let’s now look at how much storage is required for storing multimedia files for tweets.], [Thus, we learnt that, for running Twitter, in the most basic sense, the following requirements must be met:], [Here’s the actual AWS calculator cost estimation performed for this purpose.], [Thus, this most basic, unoptimized design of that we made, pays 82,164,897.81 USD = 82 million USD every year to AWS, to keep providing its storage services only.], [We have not even begun to discuss the computing costs, the data science costs in the cloud. Also, to keep this article a light read, we haven’t taken into consideration scalability solutions such as caching, multi-AZ databases and several aspects of storage itself.], [Thus, you might now understand why Elon Musk is bent on optimizing this system a lot & even implementing the “Deep Cuts” plan to reduce infrastructure costs by a billion. But trying to fire 50% of the workforce and have the rest leave because the ship is sinking still doesn't make sense. To top it off, if your major problem is infrastructure cost you don't fire engineers, you task engineers to reduce infrastructure costs. Now, we may not agree or disagree with this logic, but atleast we’ve learnt how to ballpark the financial element of the same.
], [We studied a way of estimating the storage cost borne by Twitter. But what about getting the speed of a video-game streaming platform? Or the requests per second of a payment gateway?], [Fear not, here are a few important numbers that we can use to estimate useful metrics of any software system & what corresponding technical requirements it must be able to satisfy.], [Byte Number Sizes], [Image Source], [Data], [The numbers vary depending on the language and implementation.], [Objects], [The following numbers are heavily rounded and help determine how often something needs to happen over a period of time. For example, if a server has a million requests per day, it will need to handle 12 requests per second.], [Use the table below to convert requests handled by server across different durations of time], [Image Source], [Heavily rounded per time period numbers.], [SQL Databases], [Cache: using Redis (key-value database)], [Storage benchmarks available in docs. To get client connections capacity- refer link], [Web Servers: Requests: 5–10k requests per second], [Queues/Streams - Requests: 1000–3000 requests/s. Throughput: 1MB-50MB/s (Write) / 2MB-100MB/s (Read)], [
Example queue service limits - Pub/Sub — limits, Kinesis — limits, SQS — limits], [Scrapers - Requests: 1000 per second. Example scraper service - Colly — go scraper
], [These 14 latency numbers, revealed by Dr. Dean (Google), form the foundation of systems designing & performance optimization. Using these numbers we can predict how long it would take for a system to perform its computations. Refer to this website and the image below as a simple lookup for these numbers], [Image Source
], [What do we understand from this], [A lot of back of the envelope calculations are done with just coefficients and exponents, e.g., c∗10e. Your goal is to get within an order of magnitude right that’s just e, c matters a lot less.], [What did we learn], [I hope you understood how systems are operated in terms of estimating engineering infrastructure requirements, provisions & costing. What’s the one system that you want me to target next for back of the envelope analysis?], [Get the latest posts delivered right to your inbox], [Learning from 7 unconventional stories - how a lasting, profitable business is to be built], [A beginners introduction to tensors & every stupid jargon people throw around them], [Stay up to date! Get all the latest & greatest posts delivered straight to your inbox], [True inspiration is impossible to fake], "
The History of Cloud Computing,9 OCT 2022,,"[Building a fast, inexpensive & secure internet through the power of abstraction], [Read more posts by this author.], [Checkout the article here - Link], [Get the latest posts delivered right to your inbox], [A look into Indian Higher Education system and what its future looks like], [Using AWS DMS to migrate from MongoDB to DynamoDB], [Stay up to date! Get all the latest & greatest posts delivered straight to your inbox], [True inspiration is impossible to fake], "
The Next Decade of Indian Higher Education,30 OCT 2022,,"[A look into Indian Higher Education system and what its future looks like], [Read more posts by this author.], [Indian higher education will undergo rapid changes as the nation shifts from an industrial factory system to a developed laboratory of inventions, knowledge & holistic understanding. This opens up avenues for several startups in the education space to help shape the very direction of the next decade of Indian Higher Education], [This article is a combination of multiple Government articles, policies & news that helps the reader understand the initiatives, trends & estimations about various aspects of this arena.], [This blog comprises of 2 parts :], [Indian Government's 20 year plan -], [Imaginative and flexible curricular structures will enable creative combinations of disciplines for study, and would offer multiple entry and exit points, thus, removing currently prevalent rigid boundaries and creating new possibilities for life-long learning], [Flexibility in curriculum and novel and engaging course options will be on offer to students, in addition to rigorous specialization in a subject or subjects. This will be encouraged by increased faculty and institutional autonomy in setting curricula.], [The curriculum must be exciting and relevant and updated regularly to align with the latest knowledge requirements and to meet specified learning outcomes], [Thus, curriculum, pedagogy, continuous assessment, and student support are the cornerstones of quality learning.], [First, in order to promote creativity, institutions and faculty will have the autonomy to innovate on matters of curriculum, pedagogy, and assessment within a broad framework of higher education qualifications that ensures consistency across institutions and programs and across the ODL, online, and traditional ‘in-class’ modes], [The Choice Based Credit System (CBCS) will be revised for instilling innovation and flexibility.], [Education has an important role to play in making India self-reliant. The research here hints at an optimistic leap for Indian education to evolve and eventually help the nation spearhead technical breakthroughs & deeper thinking on the most pressing matters of the world.], [And that's a future I look forward to growing up into.], [Get the latest posts delivered right to your inbox], [3 Nov 2023 – 5 min read], [4 Oct 2023 – 10 min read], [27 Jul 2023 – 5 min read], [A beginners introduction to tensors & every stupid jargon people throw around them], [Building a fast, inexpensive & secure internet through the power of abstraction], [Stay up to date! Get all the latest & greatest posts delivered straight to your inbox], [True inspiration is impossible to fake], "
Phoenix Moments,6 JUN 2022,,"[Why we should be grateful for all the low points in life.], [Read more posts by this author.], [The view I have developed of the world is a one that is always in chaos. Thus, it is as important to cherish & be grateful for the low points in this rollercoaster I believe life is.], [This is how I ended up believing that winning every time is not a good thing as well. Sometimes, just a minor reality check through a failure, helps keep you level-headed in the game. A disrupting incident in an otherwise stable period.], [Stress sometimes get the better of us, making options that help you forget reality quite logical. The more high-performance your routine, the more likely you'll find yourself burnt out, spiralling towards this.], [I'm not just talking intoxication here; this could be anything that momentarily takes your head out of the game. For me, it used to be bing streaming - getting lost in stories of others to forget mine. And while that may not be wrong in helping rise over the tide, I'm still doubtful about how sustainable it actually is. Good or bad - I want to be a part of my reality - be it experiencing or enduring. The punches are going to keep coming, so might as well focus on levelling up your endurance index each time.], [For me, what works best, is describing these suffocating instances in life, where most things seem like they're falling apart - as ""phoenix moments"" since they feel like they burn you into nothingness, but given the right amount of courage & relentlessness, they force you to rise as a better version of yourself.], [Looking back, on somedays, these very moments will be looked-upon as the ""life changing"" or ""character building"" crossroads in your life, you'll be grateful for.], [Instead of capping this to moments from famous lives, I'll be sharing an anecdote from my life.], [I wanted to pursue some interesting Computer Science (CS) courses such as networking, algorithms, cryptography etc. but since I'd enrolled for a Bachelor's in Civil Engineering, each time, I'd always be ineligible for these electives. Semester after semester passed by, begging the Professors for just 1 shot at them. In semester 6 (out of 8), I finally got allotted a course on Computer Networking but the next day itself, I received an email from the Professor that since I'd missed out on some basic CS Courses in the previous semesters, my registration was disqualified, and frankly, just a lucky mistake. So I would have to drop the course.], [From the perspective of a 21 year old, who'd been always dealt with these cards, irrespective of the excellent profile I'd managed to build over the past 2 years of intensive application based learning, the declaration was suffocating since this put not just the chance of a minors in Computer Science in question, but the very aspect of graduation in jeopardy, since a massive credits defecit had mounted up, as I would continue waiting for this courses, semester over semester, not settling for anything else.], [We've all been there - the feeling of our world just crumbling down. Heartbreak, disbelief, loneliness seem to strike the worst then - sometimes all at once, making it difficult for us to focus & deal with such conclusive-seeming setbacks. Demoralized & directionless, he started experiencing a slump in performance at his internship & a general disinterest towards pretty much everything. Nothing seemed to make sense. All those efforts gone in building a powerful enough profile that seemed eligible, feeling just so futile. Classic phoenix moment.], [But here's where the power of will comes into play. I started talking to other friends who faced similar problems, regarding course registration & once enough feedback had been registered, I started working on a web-app that would make it easier for students to be self-aware about their academic choices, right from when they joined college.], [Day and night of constant body-breaking hard-work, failures, frustrations, loneliness plagued me. Didn't matter.], [The mission was important & the passion, undying. The code was brilliant but he was running behind my launch date by a good 30 days. I once again started questioning whether it might work at all. The final day for course registration for students neared. My workload has also skyrocketed through the roof. Only a weekend remained between him & this all going to nothing. But I chose to battle this out since whether I won or lost didn't matter. I just didn't want to be down the path where I regretted not having tried my best.], [36 hours - wired in. Everything blurred away. Bug bashes, server fires, failed requests - all the punches kept coming. But by now, I'd gotten used to the mishaps & gratefully embraced them with a rush of adrenaline & a rebellious reply.], [The pilot launch drew in 2500 students, out of which around 50 or so, thanked me personally, for solving this problem. Professors from CS Department approached me to understand the working & offered their support in taking the solution further. I'd recognised his moment & lived through it with sheer will. Sleep came with a lot less restlessness after that.], [The best part about such a moment is that you stand at an important crossroads here. Between good or bad. Difficult or easy. Adventurous or safe. Since you're most vulnerable at such a point, you have to be most careful about what you pick. There's a high chance it might get ingrained as a core, basic trait of you - which becomes very hard to change later.], [So whatever you choose, make sure you've absolutely thought consciously about it. Can be as simple as not opening that time-draining application, or that pack of cigarette. Constantly just fighting instinct with actual willpower. It'll be tough and painful, trying to control what your reflexes force you towards, especially since you're hurting. But its worth it.], [2 things that I've found pretty helpful to deal in times like these are :], [This is all I had to say about these really pivotal checkpoints in one's life. All we have to do is - ""consciously decide"" - when navigating through these.
The more of these you encounter, the more you'll be grateful for such moments as they're often the best teachers], [Get the latest posts delivered right to your inbox], [21 Dec 2023 – 5 min read], [What is the CBDC & why it is going to revolutionize wholesale & retail finance], [An explainer on when to use which ML algorithms], [Stay up to date! Get all the latest & greatest posts delivered straight to your inbox], [True inspiration is impossible to fake], "
