Title,Date,Images,Paragraphs
Project WhatShopp,29 APR 2022,,"[A simple attempt I made at Product Designing to understand how designers resa], [Read more posts by this author.], [The Indian online grocery market is estimated to reach US$ 26.93billion in 2027 from US$ 3.95 billion in FY21, expanding at a CAGR of 33%.], [Personally, I've been quite bothered by how much of this market is addressed by the tech giants like Amazon, Flipkart, BigBasket, Grofers (now BlinkIt) & other players. I've always enjoyed great relations & friendships with the local stores I used to rush down to buy everything from fruits & vegetables, to sweets, condiments & other items of everyday use. Hence the urge for a solution that would take the pioneer of this decade's communication & embed into it, a business solution, where the MSMEs win.], [What started as a simple dream to work at the company who had given this as an internship  problem statement, as I waited for a bus, across its massive HQ on Hosur Road, it's blazing logo shining disruptively against the silent night, led me down to a journey of 1 month, of finding the solution to find what would define a ""e-commerce system, where everybody wins""], [Supposing is good, but finding out is better.], [The Mom Test, by Rob Fitzgerald, beautifully explains how you can get validation about your problem statement & product, without even talking about it.], [I brushed up the book on a lazy Saturday morning, and then started talking with the waiters about their grocery shopping habits. From then, I went cafe-hopping across town speaking to restaurant managers, home makers & calling friends from all over the country to understand how they'd been consuming these goods.], [From their mixed buying pattern, spread across somewhat 12 mobile applications & local interactions, I was able to draw the following conclusions], [After this, was an interesting phase where I went ahead & tried out all the existing solutions to experience & interact with the UI to understand design at the lowest level.], [This led me to actually realize some decisions that the other market players had taken, much better &  come up with my own design philosophy.], [For any strong vision to manifest, a powerful design should be at the core driving it.], [After the conclusions from the user interviews & trying out the products myself, I went on to formulate some fundamental principles I felt should be reflected in the design of the application.], [They were - Trust, Simplicity, Communication & Community], [The design for the entire project can be found in the Figma File below :], [Also, here's a simple Kanban view of the most important design decisions I took, why I took them to align with my core design philosophy], [This was the 1st project where I handled all the pre-engineering part & it gave me a holistic sense of how a product is designed & why some decisions like this, can be game changers when catering to a large user base.], [In a way, it shaped me to perceive products very differently since :)], [Get the latest posts delivered right to your inbox], [3 Apr 2021 – 4 min read], [2 Apr 2021 – 3 min read], [The origins of the journey of visualizing educational opportunities as nodes on a graph], [Expose your API over HTTPS for free using an NGINX proxy server], [Stay up to date! Get all the latest & greatest posts delivered straight to your inbox], [True inspiration is impossible to fake], "
How to HTTPS your API,26 APR 2022,,"[Expose your API over HTTPS for free using an NGINX proxy server], [Read more posts by this author.], [Serving your API over HTTPS is becoming more and more crucial by the day, especially from a usability perspective since the browsers are shedding all the HTTP and other unsecure, legacy support nowadays], [In this blog, I will teach you by example, how to generate an SSL/TLS certificate for any API you have & then use a proxy server (developed using NGINX) to basically start serving your simple HTTP API over HTTPS], [You need a domain record (A or AAA) that basically acts as the entity that the certificate will be generated for], [The only step to do here is to use for DNS service create a simple A record that points to the server you are going to use to host the API.], [For me, I did it like this for a project :], [Before you start the next step, make sure the DNS has propagated properly by running the following commands], [Replace api.domain.com with your own API_DOMAIN_NAME], [Next, we will generate a certificate attached to this domain.], [You can generate a public certificate & private key pair for free using letsencrypt.], [For this, you 1st install the package on your machine], [Next you generate a simple certificate for the domain you want to certify using the certbot API that you can now access
For this step you need your port 80 unblocked so get that done by simply running
sudo fuser -k 80/tcp], [Then you can safely run], [Now, the CLI will prompt you to enter the domain name (here, it is api.domain.com) & then it will generate a pair of a public certificate & a private key], [This is what will be actually used by our proxy server to even respond to requests to this API_DOMAIN_NAME], [This is a simple nginx server we will setup that will listen on port 80 (HTTP) & port 443 (HTTPS) of our server & redirected it to our api's port.], [We just pass the location of the generated certificate-key pair to NGINX in its configuration file], [For writing a nginx.conf while, first install nginx], [First stop running nginx service by running], [Next you should go to the directory where this configuration file is stored & override the code with the simple proxy code you have], [In there, we specify a simple rule to pass the 80 (HTTP) & 443 (HTTPS) traffic to our backend. Here, I have even gone ahead & made this a load balancer with stickiness by specifying my api resolvers running on ports 8080, 8081, 8082 & add a #ip_hash configuration option so that once the client gets associated with one api, its requests are always directed there:], [And we pass the locations of the generated public certificate & private key pair to the nginx rule that is resolving port 443 using SSL.], [Here's my configuration file], [For you api.domain.com would be whatever your API_DOMAIN_NAME is], [Then simply, clear any pending services on ports 80 & 443 restart nginx on them using :], [That's that ! You've made your API HTTPS now], [Get the latest posts delivered right to your inbox], [17 Apr 2022 – 17 min read], [4 Apr 2021 – 5 min read], [2 Apr 2021 – 4 min read], [A simple attempt I made at Product Designing to understand how designers resa], [What if all the stakeholders in a logistics system were just nodes in a graph ?], [Stay up to date! Get all the latest & greatest posts delivered straight to your inbox], [True inspiration is impossible to fake], "
Why Work at a Startup ? - Part I,12 MAY 2021,"[https://blog.ankitsanghvi.in/content/images/2021/05/IMG_20210318_205206.jpg], ","[The first of many chapters in my journey of working at the startup - Farmako Healthcare], [Read more posts by this author.], [On February 10th, 2021, through a LinkedIn connect, I got the opportunity to work as a React Developer at Farmako Healthcare, a healthtech startup, then based out of Calangute, Goa, India.], [I am not going to lie, the thing that initially drew me to the company was the brand value it had achieved by securing a backing from Y Combinator, an amazing startup incubator and accelerator led by some of the most inspiring visionaries I've come to idolize.], [However, as I write this article, I'm 3 months into this, and not a day goes by when I don't smile about jumping at this window - against the wishes of my family, an increasingly challenging online semester, amidst a global pandemic and a couple other imbalanced things in life.], [In my 3 months as an intern (as of May 2021), I have not written a lot of code, maybe lesser than what I would have if I stayed put with my routine, but I have grown as a person and earned experiences and people, that pretty much dwarf what most certifications, accomplishments and compensations, any other work would have yielded.], [This journey has been a tale of friendship, sacrifices, losses, dreams, chaos but for the most part, it resonates a glimmer of undying hope, to help society, to make something people want.], [Farmako is the brilliant brainchild of 3 insanely crazy, visionary engineers out of IIT Roorkee, India :], [Farmako is a healthtech startup that takes the 4 main components of any healthcare system i.e.], [and digitally integrates them all in a privacy regulated manner in a cloud of software services, such that the speed and effectiveness of communication between these components would make the healthcare pipeline - right from symptom to diagnosis to testing prescription to recovery - cheaper, faster and more accessible for anyone.], [Also, once enough records are safely stored in the database, Farmako can actually perform machine learning to predict future disease outbreaks, effective medications and potential hotspots where most healthcare resources and expertise needs to be diverted to.], [Also, the thing that sets apart Farmako from most startups I've seen is that most discussions were not on monetizing and profiting from the idea, but on helping make healthcare technology, a real support system for everyone.  ], [Also, funny thing is these post titles and job divisions of CEO, CTO etc. are nothing but names to the outside world as with the kind of amicable culture inside Farmako, literally everyone is doing everything. The most interesting kind of workplace I could possibly ask for.], [My first introductions to the company started with a LinkedIn post announcing for hiring a React Developer Intern. I was lucky to be tagged onto it by a friend.
As researched more about the people, I got amazed more and more about how 3 extraordinarily talented people, from different walks of life, had gotten together on an idea and stood by it, since 2018 (3 years back), against all odds.], [I even went through one of their blogs on why something like this had to be done.], [The more I researched, the more I was convinced that the problem, the idea, the people and the approach all seemed to somehow fit perfectly into actually solving one of the biggest problems of the 21st century. I was drawn to it quite strongly], [Applied. Interview scheduled. I was battered with questions about software development and in fact, the project I was most proud of upto that point in my journey as a programmer was hacked within a minute by Nikhil Bhaiya. (""Bhaiya"" means ""brother"", in Hindi language).
In those 30 minutes I actually experienced the diversity in thoughts and approach of Aman Bhaiya and Nikhil Bhaiya. Someday later, Aman Bhaiya, drawing from Paul Graham's observations, would explain to me, how 2 distinct kinds of people - hackers and painters, come together to create marvellous pieces together], [Case in point : 1st April, 1976, California, USA. A Reed college dropout, brilliant artist meets a University of Colorado expellee, elite hacker and the 2 set up a small venture selling home computers from the artist's parents' garage. As of 2021, this venture has grown to a $2 trillion company, we know by the name Apple Inc. - brainchild of hacker Steve Wozniak and artist Steve Jobs.], [A funny anecdote that comes to mind is that Aman Bhaiya started conversation with how life was going and at 1 point Nikhil Bhaiya just barged into the talk with - ""Is Node JS single threaded or multi-threaded ?"". After a short answer, Aman Bhaiya realised that they hadn't introduced themselves to me yet so after about 5 minutes of awkward questioning, I hear - ""Hi ! I'm Aman, and these are my co-founders Nikhil and Kaishu (who was wired into code, and just greeted me with a classic ✌).""], [Post-interview, one thing was for sure though. Something was really different about these entrepreneurs. I knew I had to get to know them better hence I kept spamming Aman Bhaiya with text messages asking for the technical assignment that would be the last evaluation in my application for an internship.], [Funny thing is, first 2 hours of starting the assignment, I am dead spirit-broken because of some small bug because of which the project wouldn't even initialize. At this point I start having 2nd thoughts.], [I mean - I had a full-blown online semester going on, I had institute club commitments, I wished to continue playing around in shallow waters of being a student developer and enjoy the luxury of being a child in a family and there was 1 other integral reason as well which was yearning me to give up on this chance and move on.], [Somehow, deep down, I knew I had to do this. 20 years down the line, I didn't want to face myself regretting the question - ""When you had the chance to work with a bunch of great people on a transformational idea, where did you go ?""], [That was it. 22 hours. Wired in. At the end, I was able to create a simple dashboard that could be used by a doctor for viewing the medical records of the upcoming patient appointments.], [For the first time ever since I started programming, I felt a wave of confidence wash over me, that somehow, amidst the nights of staring frustratingly at errors for hours altogether, I'd managed to gather enough grit to disect a problem into code blocks and weave it all together in a functioning software solution that people could use.], [A day after the submission, I get a call from Aman Bhaiya, and he told me that they really liked my code and quite casually, his next question was - ""How soon can you move to Goa ?""], [Now see, I come from a family of order and security. The path I was expected to tread was one of a Masters from a college of repute, a high-paying engineering job at a tech giant and a settled life. So, a startup was a big red flag on this road. And upto this point, these were the exact footsteps I'd been taking.], [But this time, I somehow gathered enough confidence to go against my family and explore this uncharted territory, purely because my heart knew this was the place I had to be in. Sometimes it's okay to be stupid and instinctive. Sometimes you have to trust your gut and take a leap, however irrational it may seem. Flight ticket booked for the day after.], [That night, at around 11pm, I was introduced to the team in a more informal fashion.], [Aman Bhaiya was getting anxious about not having the monitor properly set up for a video call. Nikhil Bhaiya was getting teased about flexing his AirPods on call. Kaishu Bhaiya walked up from behind, sipping a chocolate smoothie. Hemil, the Flutter Developer intern was being laughed at, for turning his camera on for the 1st time on call. Arun Bhaiya, the graphic designer, smiled, not understanding most of what we were saying as we spoke in Hindi, a language that was not-native to the South Indian origins he hails from.  Ankita Didi was laughing, complaining about being detained at Khosla House (I think it's a guest house) back in IIT Roorkee, where she was balancing her dissertation side by side with a graphic designing internship at Farmako.], [I remember laughing a lot without realizing at how this strangely messed up medley of people would become family to me in the upcoming weeks, and how we would embark upon a great journey on revitalizing the healthcare situation in India.

As I lay down that night, I could barely believe how this had all happened so fast. Tomorrow, I'd meet the friend who was pivotal to this entire transformative journey, as I started a new chapter, and say my thanks, goodbyes and promise to keep in touch.], [Day after, I'd fly.], [Get the latest posts delivered right to your inbox], [15 Jan 2024 – 3 min read], [31 Mar 2023 – 6 min read], [27 Feb 2023 – 6 min read], [The chapter of of friendship, rediscovery and relentless efforts], [Designing a lightweight, strong, customizable, comfortable steering wheel for a racecar], [Stay up to date! Get all the latest & greatest posts delivered straight to your inbox], [True inspiration is impossible to fake], "
